{
  "manifest_id": "wrw_er.game_identity.v1",
  "game_identity": {
    "title": "Where Ravens Wait: Eternal Reckoning",
    "short_title": "Where Ravens Wait",
    "abbreviation": "WRW:ER",
    "genre": "single_player_rpg",
    "engine": "Yggdrasil World Engine",
    "initial_platform_target": "macOS",
    "runtime_strategy": "native_macos_first",
    "repository_boundary": {
      "ywe_repository": "agnostic_engine_blueprint",
      "product_repository": "platform_specific_macos_runtime"
    }
  },
  "canonical_position": {
    "ash_model_of_the_universe": "cosmological_simulation_ontology",
    "yggdrasil_world_engine": "agnostic_world_engine_framework",
    "where_ravens_wait_eternal_reckoning": "first_single_player_rpg_built_with_ywe",
    "native_macos_runtime": "first_downstream_platform_specific_product_implementation"
  },
  "non_goals_for_ywe_repository": [
    "swift_implementation",
    "metal_renderer",
    "swiftui_views",
    "appkit_lifecycle",
    "gamecontroller_input_code",
    "macos_persistence_implementation",
    "platform_build_tooling",
    "platform_specific_runtime_code"
  ],
  "schema_ref": "https://ywe.local/schemas/game_identity_manifest_schema.json"
}
